ZFOX,ZeroFox Holdings Inc. Common Stock
ZFOXW,ZeroFox Holdings Inc. Warrants
ZG,Zillow Group Inc. Class A Common Stock
ZI,ZoomInfo Technologies Inc Common Stock
ZIMV,ZimVie Inc. Common Stock
ZING,FTAC Zeus Acquisition Corp. Class A Common Stock
ZINGU,FTAC Zeus Acquisition Corp. Unit
ZINGW,FTAC Zeus Acquisition Corp. Warrant
ZION,Zions Bancorporation N.A. Common Stock
ZIONL,Zions Bancorporation 6.95% Fixed-to-Floating Rate Subordinated Notes
ZIONO,Zions Bancorporation N.A. Dep Shs Repstg 1/40th Perp Pfd Ser G
ZIONP,Zions Bancorporation N.A. Depositary Shares (Each representing 1/40th Interest in a Share of Series A Floating-Rate Non-Cumulative Perpetual Preferred Stock)
ZIVO,Zivo Bioscience Inc. Common Stock
ZIVOW,Zivo Bioscience Inc. Warrants
ZM,Zoom Video Communications Inc. Class A Common Stock
ZNTL,Zentalis Pharmaceuticals Inc. Common Stock
ZOM,Zomedica Corp. Common Shares
ZS,Zscaler Inc. Common Stock
ZT,Zimmer Energy Transition Acquisition Corp. Class A Common Stock
ZTAQU,Zimmer Energy Transition Acquisition Corp. Units
ZTAQW,Zimmer Energy Transition Acquisition Corp. Warrants
ZTR,Virtus Total Return Fund Inc.
ZTS,Zoetis Inc. Class A Common Stock
ZUMZ,Zumiez Inc. Common Stock
ZVO,Zovio Inc. Common Stock
ZWRK,Z-Work Acquisition Corp. Class A Common Stock
ZWRKW,Z-Work Acquisition Corp. Warrant
ZWS,Zurn Elkay Water Solutions Corporation Common Stock
ZYNE,Zynerba Pharmaceuticals Inc. Common Stock
ZYXI,Zynex Inc. Common Stock
DRIP,Direxion Daily S&P Oil & Gas Exp. & Prod. Bear 2X Shares
DRN,Direxion Daily Real Estate Bull 3X Shares
DRV,Direxion Daily Real Estate Bear 3X Shares
DSEP,FT Cboe Vest U.S. Equity Deep Buffer ETF - September
DSJA,Innovator Double Stacker ETF - January
DSOC,Innovator Double Stacker ETF - October
DSPC,AXS De-SPAC ETF
DSTL,Distillate U.S. Fundamental Stability & Value ETF
DTD,WisdomTree U.S. Total Dividend Fund
DUG,ProShares UltraShort Oil & Gas
DURA,VanEck Durable High Dividend ETF
DUSA,Davis Fundamental ETF Trust Davis Select U.S. Equity ETF
DUSL,Direxion Daily Industrials Bull 3X Shares
DVLU,First Trust Dorsey Wright Momentum & Value ETF
DVOL,First Trust Dorsey Wright Momentum & Low Volatility ETF
DVY,iShares Select Dividend ETF
DWAS,Invesco DWA SmallCap Momentum ETF
DWEQ,AdvisorShares Dorsey Wright Alpha Equal Weight ETF
DWMC,AdvisorShares Dorsey Wright Micro-Cap ETF
DWPP,First Trust Dorsey Wright People's Portfolio ETF
DWSH,AdvisorShares Dorsey Wright Short ETF
DWUS,AdvisorShares Dorsey Wright FSM US Core ETF
DXD,ProShares UltraShort Dow30
DYLD,LeaderShares Dynamic Yield ETF
DYNF,BlackRock U.S. Equity Factor Rotation ETF
DZZ,Invesco DB Gold Fund
EAGG,iShares ESG Aware U.S. Aggregate Bond ETF
EATZ,AdvisorShares Restaurant ETF
EBLU,Ecofin Global Water ESG Fund
ECLN,First Trust EIP Carbon Impact ETF
ECOZ,TrueShares ESG Active Opportunities ETF
EDOW,First Trust Dow 30 Equal Weight ETF
EDV,Vanguard Extended Duration Treasury ETF
EES,WisdomTree U.S. SmallCap Fund
EFIV,SPDR S&P 500 ESG ETF
EGIS,2ndVote Society Defended ETF
EINC,VanEck Energy Income ETF
EMLP,First Trust North American Energy Infrastructure Fund
EMNT,PIMCO Enhanced Short Maturity Active ESG Exchange-Traded Fund
EMTY,ProShares Decline of the Retail Store ETF
ENFR,Alerian Energy Infrastructure ETF
ENTR,ERShares Entrepreneurs ETF
EPRE,First Trust TCW ESG Premier Equity ETF
EPRF,Innovator S&P Investment Grade Preferred ETF
EPS,WisdomTree U.S. LargeCap Fund
EQAL,Invesco Russell 1000 Equal Weight ETF
EQL,ALPS Equal Sector Weight ETF
EQOP,Natixis U.S. Equity Opportunities ETF
EQRR,ProShares Equities for Rising Rates ETF
EQUL,IQ Engender Equality ETF
EQWL,Invesco S&P 100 Equal Weight ETF
ERM,EquityCompass Risk Manager ETF
ERX,Direxion Energy Bull 2X Shares
ERY,Direxion Daily Energy Bear 2x Shares
ESG,FlexShares STOXX US ESG Select Index Fund
ESGA,American Century Sustainable Equity ETF
ESGS,Columbia U.S. ESG Equity Income ETF
ESGU,iShares ESG Aware MSCI USA ETF
ESGV,Vanguard ESG U.S. Stock ETF
ESGY,American Century Sustainable Growth ETF
ESHY,Xtrackers J.P. Morgan ESG USD High Yield Corporate Bond ETF
ESML,iShares ESG Aware MSCI USA Small-Cap ETF
ESMV,iShares ESG MSCI USA Min Vol Factor ETF
ESUS,ETRACS 2x Leveraged MSCI US ESG Focus TR ETN
ETHO,Etho Climate Leadership U.S. ETF
EUSA,iShares MSCI USA Equal Weighted ETF
EUSB,iShares ESG Advanced Total USD Bond Market ETF
EVSTC,Eaton Vance NextShares Trust
EVX,VanEck Environmental Services ETF
EWC,iShares MSCI Canada Index Fund
EWCO,Invesco S&P 500 Equal Weight Communication Services ETF
EWMC,Invesco S&P MidCap 400 Equal Weight ETF
EWRE,Invesco S&P 500 Equal Weight Real Estate ETF
EWSC,Invesco S&P SmallCap 600 Equal Weight ETF
EWW,iShares Inc iShares MSCI Mexico ETF
EZM,WisdomTree U.S. MidCap Fund
FAAR,First Trust Alternative Absolute Return Strategy ETF
FAB,First Trust Multi Cap Value AlphaDEX Fund
FAD,First Trust Multi Cap Growth AlphaDEX Fund
FALN,iShares Fallen Angels USD Bond ETF
FAPR,FT Cboe Vest U.S. Equity Buffer ETF - April
FAS,Direxion Financial Bull 3X Shares
FAUG,FT Cboe Vest U.S. Equity Buffer ETF - August
FAZ,Direxion Financial Bear 3X Shares
QLV,FlexShares US Quality Low Volatility Index Fund
QMAR,FT Cboe Vest Nasdaq-100 Buffer ETF - March
QMN,IQ Hedge Market Neutral Tracker ETF
QMOM,Alpha Architect U.S. Quantitative Momentum ETF
QQC,Simplify Nasdaq 100 PLUS Convexity ETF
QQD,Simplify Nasdaq 100 PLUS Downside Convexity ETF
QQEW,First Trust NASDAQ-100 Equal Weighted Index Fund
QQH,HCM Defender 100 Index ETF
QQJG,Invesco ESG NASDAQ Next Gen 100 ETF
QQMG,Invesco ESG NASDAQ 100 ETF
QQQ,Invesco QQQ Trust Series 1
QQQA,ProShares Nasdaq-100 Dorsey Wright Momentum ETF
QQQE,Direxion NASDAQ-100 Equal Weighted Index Shares
QQQJ,Invesco NASDAQ Next Gen 100 ETF
QQQM,Invesco NASDAQ 100 ETF
QQQN,VictoryShares Nasdaq Next 50 ETF
QQXT,First Trust NASDAQ-100 Ex-Technology Sector Index Fund
QRFT,QRAFT AI-Enhanced U.S. Large Cap ETF
QRMI,Global X Nasdaq 100 Risk Managed Income ETF
QTAP,Innovator Growth Accelerated Plus ETF - April
QTEC,First Trust NASDAQ-100-Technology Sector Index Fund
QTJL,Innovator Growth Accelerated Plus ETF - July
QTOC,Innovator Growth Accelerated Plus ETF - October
QTR,Global X Nasdaq 100 Tail Risk ETF
QUAL,iShares MSCI USA Quality Factor ETF
QULL,ETRACS 2x Leveraged MSCI US Quality Factor TR ETN
QUS,SPDR MSCI USA StrategicFactors ETF
QVAL,Alpha Architect U.S. Quantitative Value ETF
QVML,Invesco S&P 500 QVM Multi-factor ETF
QVMM,Invesco S&P MidCap 400 QVM Multi-factor ETF
QVMS,Invesco S&P SmallCap 600 QVM Multi-factor ETF
QYLD,Global X NASDAQ-100 Covered Call ETF
QYLG,Global X Nasdaq 100 Covered Call & Growth ETF
RAFE,PIMCO RAFI ESG U.S. ETF
RBND,SPDR Bloomberg SASB Corporate Bond ESG Select ETF
RCD,Invesco S&P 500 Equal Weight Consumer Discretionary ETF
RDFI,Rareview Dynamic Fixed Income ETF
RDIV,Invesco Exchange-Traded Fund Trust II Invesco S&P Ultra Divide
RDVY,First Trust Rising Dividend Achievers ETF
RECS,Columbia Research Enhanced Core ETF
REGL,ProShares S&P MidCap 400 Dividend Aristocrats ETF
REIT,ALPS Active REIT ETF
REK,ProShares Short Real Estate
REM,iShares Trust iShares Mortgage Real Estate ETF
RESP,WisdomTree U.S. ESG Fund
RETL,Direxion Daily Retail Bull 3X Shares ETF
REVS,Columbia Research Enhanced Value ETF
REW,ProShares UltraShort Technology
REZ,iShares Residential and Multisector Real Estate ETF
RFDA,RiverFront Dynamic US Dividend Advantage ETF
RFFC,RiverFront Dynamic US Flex-Cap ETF
RFG,Invesco S&P MidCap 400 Pure Growth ETF
RFV,Invesco S&P MidCap 400 Pure Value ETF
RGI,Invesco S&P 500 Equal Weight Industrials Portfolio
RHRX,RH Tactical Rotation ETF
RHS,Invesco S&P 500 Equal Weight Consumer Staples ETF
RHTX,RH Tactical Outlook ETF
RIET,Hoya Capital High Dividend Yield ETF
RIGZ,Viridi Bitcoin Miners ETF
RINF,ProShares Inflation Expectations ETF
RISN,Inspire Tactical Balanced ETF
RISR,FolioBeyond Rising Rates ETF
RJA,AB Svensk Ekportkredit (Swedish Export Credit Corporation)
RJI,AB Svensk Ekportkredit (Swedish Export Credit Corporation)
RJN,AB Svensk Ekportkredit (Swedish Export Credit Corporation)
RJZ,AB Svensk Ekportkredit (Swedish Export Credit Corporation)
RNDV,US Equity Dividend Select ETF
RNEM,Emerging Markets Equity Select ETF
RNLC,Large Cap US Equity Select ETF
RNMC,Mid Cap US Equity Select ETF
RNSC,Small Cap US Equity Select ETF
RODI,Barclays PLC
ROM,ProShares Ultra Technology
ROOF,IQ CBRE NextGen Real Estate ETF
RORO,ATAC US Rotation ETF
ROUS,Hartford Multifactor U.S. Equity ETF
RPG,Invesco S&P 500 Pure Growth ETF
RPV,Invesco S&P 500 Pure Value ETF
RRH,Advocate Rising Rate Hedge ETF
RSP,Invesco S&P 500 Equal Weight ETF
RSPE,Invesco ESG S&P 500 Equal Weight ETF
RSPY,Revere Sector Opportunity ETF
RTAI,Rareview Tax Advantaged Income ETF
RTM,Invesco S&P 500 Equal Weight Materials ETF
RUFF,Alpha Dog ETF
RVNU,Xtrackers Municipal Infrastructure Revenue Bond ETF
RWJ,Invesco Exchange-Traded Fund Trust II Invesco S&P SmallCap 600
RWK,Invesco Exchange-Traded Fund Trust II Invesco S&P MidCap 400 R
RWL,Invesco Exchange-Traded Fund Trust II Invesco S&P 500 Revenue 
RWM,ProShares Short Russell2000
RWR,SPDR DJ Wilshire REIT ETF
RXD,ProShares UltraShort Health Care
RXL,ProShares Ultra Health Care
RYE,Invesco S&P 500 Equal Weight Energy ETF
RYF,Invesco S&P 500 Equal Weight Financial ETF
RYH,Invesco S&P 500 Equal Weight Health Care ETF
RYJ,Invesco Raymond James SB-1 Equity ETF
RYLD,Global X Russell 2000 Covered Call ETF
RYT,Invesco S&P 500 Equal Weight Technology ETF
RYU,Invesco S&P 500 Equal Weight Utilities ETF
RZG,Invesco S&P SmallCap 600 Pure Growth ETF
RZV,Invesco S&P SmallCap 600 Pure Value ETF
SAA,ProShares Ultra SmallCap600
SAEF,Schwab Strategic Trust Schwab Ariel ESG ETF
SAVN,LifeGoal Conservative Wealth Builder ETF
SBB,ProShares Short SmallCap600
SBND,Columbia Short Duration Bond ETF
SCC,ProShares UltraShort Consumer Services
SCDL,ETRACS 2x Leveraged US Dividend Factor TR ETN
SCHA,Schwab U.S. Small-Cap ETF
SCHB,Schwab U.S. Broad Market ETF
SCHD,Schwab US Dividend Equity ETF
SCHG,Schwab U.S. Large-Cap Growth ETF
SCHH,Schwab U.S. REIT ETF
SCHI,Schwab 5-10 Year Corporate Bond ETF
SCHJ,Schwab 1-5 Year Corporate Bond ETF
SCHK,Schwab 1000 Index ETF
SCHM,Schwab U.S. Mid Cap ETF
SCHO,Schwab Short-Term U.S. Treasury ETF
SCHP,Schwab U.S. TIPS ETF
SCHQ,Schwab Long-Term U.S. Treasury ETF
SCHR,Schwab Intermediate-Term U.S. Treasury ETF
SCHV,Schwab U.S. Large-Cap Value ETF
SCHX,Schwab U.S. Large-Cap ETF
SCO,ProShares UltraShort Bloomberg Crude Oil
SDCI,USCF SummerHaven Dynamic Commodity Strategy No K-1 Fund
SDD,ProShares UltraShort SmallCap600
SDEF,Sound Enhanced Fixed Income ETF
SDEI,Sound Equity Income ETF
SDOG,ALPS Sector Dividend Dogs ETF
SDOW,UltraPro Short Dow30
SDP,ProShares UltraShort Utilities
SDS,ProShares UltraShort S&P500
SDVY,First Trust SMID Cap Rising Dividend Achievers ETF
SDY,SPDR S&P Dividend ETF
SECT,Northern Lights Fund Trust IV Main Sector Rotation ETF
SEF,ProShares Short Financials
SEIX,Virtus Seix Senior Loan ETF
SENT,AdvisorShares Alpha DNA Equity Sentiment ETF
SEPZ,Listed Funds Trust TrueShares Structured Outcome (September) E
SFIG,WisdomTree U.S. Short Term Corporate Bond Fund
SFY,SoFi Select 500 ETF
SFYF,SoFi Social 50 ETF
SFYX,SoFi Next 500 ETF
SGDM,Sprott Gold Miners ETF
SGOV,iShares 0-3 Month Treasury Bond ETF
SH,ProShares Short S&P500
SHAG,WisdomTree Yield Enhanced U.S. Short-Term Aggregate Bond Fund
SHE,SPDR Series Trust SPDR SSGA Gender Diversity Index ETF
SHM,SPDR Nuveen Bloomberg Short Term Municipal Bond ETF
SHUS,Syntax Stratified U.S. Total Market Hedged ETF
SHV,iShares Short Treasury Bond ETF
SHY,iShares 1-3 Year Treasury Bond ETF
SHYD,VanEck ETF Trust VanEck Short High Yield Muni ETF
SIJ,ProShares UltraShort Industrials
SIMS,SPDR S&P Kensho Intelligent Structures ETF 
SIVR,abrdn Physical Silver Shares ETF
SIXA,ETC 6 Meridian Mega Cap Equity ETF
AAA,Investment Managers Series Trust II AXS First Priority CLO Bon
ABEQ,Absolute Select Value ETF
ACES,ALPS Clean Energy ETF
ACIO,ETF Series Solutions Aptus Collared Income Opportunity ETF
ACSI,American Customer Satisfaction ETF
ACTV,LeaderShares Activist Leaders ETF
ACVF,American Conservative Values ETF
ADME,APTUS Drawdown Managed Equity ETF
AESR,Anfield U.S. Equity Sector Rotation ETF
AFLG,First Trust Active Factor Large Cap ETF
AFMC,First Trust Active Factor Mid Cap ETF
AFSM,First Trust Active Factor Small Cap ETF
AGG,iShares Core U.S. Aggregate Bond ETF
AGGY,WisdomTree Yield Enhanced U.S. Aggregate Bond Fund
AGQ,ProShares Ultra Silver
AGZ,iShares  Agency Bond ETF
AGZD,WisdomTree Interest Rate Hedged U.S. Aggregate Bond Fund
AHHX,Adaptive High Income ETF
AHYB,American Century Select High Yield ETF
AIEQ,AI Powered Equity ETF
AIRR,First Trust RBA American Industrial Renaissance ETF
AIVL,WisdomTree U.S. AI Enhanced Value Fund
ALTL,Pacer Lunt Large Cap Alternator ETF
AMAX,RH Hedged Multi-Asset Income ETF
AMJ,J P Morgan Chase & Co
AMLP,Alerian MLP ETF
AMNA,ETRACS Alerian Midstream Energy Index ETN
AMND,UBS AG ETRACS Alerian Midstream Energy High Dividend Index ETN
AMOM,QRAFT AI-Enhanced U.S. Large Cap Momentum ETF
AMTR,UBS AG
AMUB,UBS AG
AMZA,InfraCap MLP ETF
APRZ,Trust TrueShares Structured Outcome (April) ETF
AQGX,AI Quality Growth ETF
ARMR,Exchange Listed Funds Trust Armor US Equity Index ETF
ASPY,ASYMshares ASYMmetric S&P 500 ETF
ATFV,Alger 35 ETF
ATMP,Barclays PLC
AUGZ,TrueShares Structured Outcome (August) ETF
AUSF,Global X Funds Global X Adaptive U.S. Factor ETF
AVLV,Avantis U.S. Large Cap Value ETF
AVMU,Avantis Core Municipal Fixed Income ETF
AVUS,Avantis U.S. Equity ETF
AVUV,Avantis U.S. Small Cap Value ETF
AZAA,AllianzIM U.S. Large Cap Buffer10 APR ETF
AZAJ,AllianzIM U.S. Large Cap Buffer10 Jan ETF
AZAL,AllianzIM U.S. Large Cap Buffer10 Jul ETF
AZAO,AllianzIM U.S. Large Cap Buffer10 Oct ETF
AZBA,AllianzIM U.S. Large Cap Buffer20 APR ETF
AZBJ,AllianzIM U.S. Large Cap Buffer20 Jan ETF
AZBL,AllianzIM U.S. Large Cap Buffer20 Jul ETF
AZBO,AllianzIM U.S. Large Cap Buffer20 Oct ETF
BAB,Invesco Taxable Municipal Bond ETF
BAL,Barclays PLC
BALT,Innovator Defined Wealth Shield ETF
BAPR,Innovator U.S. Equity Buffer ETF - April 
BAR,Graniteshares Gold Trust
BAUG,Innovator U.S. Equity Buffer ETF - August
BBC,Virtus LifeSci Biotech Clinical Trials ETF
BBCA,JPMorgan BetaBuilders Canada ETF
BBH,VanEck Biotech ETF
BBMC,JPMorgan BetaBuilders U.S. Mid Cap Equity ETF
BBP,Virtus LifeSci Biotech Products ETF
BBRE,JPMorgan BetaBuilders MSCI U.S. REIT ETF 
BBSA,JPMorgan BetaBuilders 1-5 Year U.S. Aggregate Bond ETF
BBSC,JPMorgan BetaBuilders U.S. Small Cap Equity ETF
BBUS,JPMorgan BetaBuilders U.S. Equity ETF
BCD,abrdn Bloomberg All Commodity Longer Dated Strategy K-1 Free E
BCI,abrdn Bloomberg All Commodity Strategy K-1 Free ETF
BCM,Barclays PLC
BDCX,ETRACS Quarterly Pay 1.5X Leveraged MVIS BDC Index ETN due Jun
BDCZ,UBS AG
BDEC,Innovator U.S. Equity Buffer ETF - December
BECO,BlackRock Future Climate and Sustainable Economy ETF
BEDZ,AdvisorShares Hotel ETF
BERZ,MicroSectors FANG & Innovation -3x Inverse Leveraged ETN
BFEB,Innovator U.S. Equity Buffer ETF - February
BFIT,Global X Health & Wellness ETF
BFOR,Barron's 400
BGLD,FT Cboe Vest Gold Strategy Quarterly Buffer ETF
BIB,ProShares Ultra Nasdaq Biotechnology
BIDS,Amplify Digital & Online Trading ETF
BIL,SPDR Bloomberg 1-3 Month T-Bill ETF
BILS,SPDR Bloomberg 3-12 Month T-Bill ETF
BIS,ProShares UltraShort Nasdaq Biotechnology
BIV,Vanguard Intermediate-Term Bond ETF
BIZD,VanEck BDC Income ETF 
BJAN,Innovator U.S. Equity Buffer ETF - January
BJK,VanEck Gaming ETF
BJUL,Innovator U.S. Equity Buffer ETF - July
BJUN,Innovator U.S. Equity Buffer ETF - June
BKAG,BNY Mellon Core Bond ETF
BKHY,BNY Mellon High Yield Beta ETF
BKLC,BNY Mellon US Large Cap Core Equity ETF
BKLN,Invesco Senior Loan ETF
BKMC,BNY Mellon US Mid Cap Core Equity ETF
BKSB,BNY Mellon Short Duration Corporate Bond ETF
BKSE,BNY Mellon US Small Cap Core Equity ETF
BKUI,BNY Mellon Ultra Short Income ETF
BLV,Vanguard Long-Term Bond ETF
BMAR,Innovator U.S. Equity Buffer ETF - March
BMAY,Innovator U.S. Equity Buffer ETF - May
BND,Vanguard Total Bond Market ETF
BNDC,FlexShares Core Select Bond Fund
BNDD,Quadratic Deflation ETF
BNKD,Bank Of Montreal
BNKU,Bank Of Montreal
BNO,United States Brent Oil Fund LP ETV
BNOV,Innovator U.S. Equity Buffer ETF - November
BOCT,Innovator U.S. Equity Buffer ETF - October
BOIL,ProShares Ultra Bloomberg Natural Gas
BOSS,Global X Funds Global X Founder-Run Companies ETF
BOUT,Innovator IBD Breakout Opportunities ETF
BSCM,Invesco BulletShares 2022 Corporate Bond ETF
BSCN,Invesco BulletShares 2023 Corporate Bond ETF
BSCO,Invesco BulletShares 2024 Corporate Bond ETF
BSCP,Invesco BulletShares 2025 Corporate Bond ETF
BSCQ,Invesco BulletShares 2026 Corporate Bond ETF
BSCR,Invesco BulletShares 2027 Corporate Bond ETF
BSCS,Invesco BulletShares 2028 Corporate Bond ETF
BSCT,Invesco BulletShares 2029 Corporate Bond ETF
BSCU,Invesco BulletShares 2030 Corporate Bond ETF
BSCV,Invesco BulletShares 2031 Corporate Bond ETF
BSEP,Innovator U.S. Equity Buffer ETF - September
BSJM,Invesco BulletShares 2022 High Yield Corporate Bond ETF
BSJN,Invesco BulletShares 2023 High Yield Corporate Bond ETF
BSJO,Invesco BulletShares 2024 High Yield Corporate Bond ETF
BSJP,Invesco BulletShares 2025 High Yield Corporate Bond ETF
BSJQ,Invesco BulletShares 2026 High Yield Corporate Bond ETF
BSJR,Invesco BulletShares 2027 High Yield Corporate Bond ETF
BSJS,Invesco BulletShares 2028 High Yield Corporate Bond ETF
BSJT,Invesco BulletShares 2029 High Yield Corporate Bond ETF
BSMM,Invesco BulletShares 2022 Municipal Bond ETF
BSMN,Invesco BulletShares 2023 Municipal Bond ETF
BSMO,Invesco BulletShares 2024 Municipal Bond ETF
BSMP,Invesco BulletShares 2025 Municipal Bond ETF
BSMQ,Invesco BulletShares 2026 Municipal Bond ETF
BSMR,Invesco BulletShares 2027 Municipal Bond ETF
BSMS,Invesco BulletShares 2028 Municipal Bond ETF
BSMT,Invesco BulletShares 2029 Municipal Bond ETF
BSMU,Invesco BulletShares 2030 Municipal Bond ETF
BSMV,Invesco BulletShares 2031 Municipal Bond ETF
BTAL,AGFiQ U.S. Market Neutral Anti-Beta Fund
BTEC,Principal Healthcare Innovators ETF
BUFD,FT Cboe Vest Fund of Deep Buffer ETF
BUFF,Innovator Laddered Allocation Power Buffer ETF
BUFG,FT Cboe Vest Buffered Allocation Growth ETF
BUFR,FT Cboe Vest Fund of Buffer ETFs
BUFT,FT Cboe Vest Buffered Allocation Defensive ETF
BUL,Pacer US Cash Cows Growth ETF
BULZ,MicroSectors FANG & Innovation 3X Leveraged ETN
BUZZ,VanEck Social Sentiment ETF
CACG,ClearBridge All Cap Growth ESG ETF
JPUS,JPMorgan Diversified Return U.S. Equity ETF
JQUA,JPMorgan U.S. Quality Factor ETF
JRE,Janus Henderson U.S. Real Estate ETF
JRNY,ALPS Global Travel Beneficiaries ETF
JSCP,JPMorgan Short Duration Core Plus ETF
JSMD,Janus Henderson Small/Mid Cap Growth Alpha ETF
JSML,Janus Henderson Small Cap Growth Alpha ETF
JULZ,TrueShares Structured Outcome (July) ETF
JUNZ,TrueShares Structured Outcome (June) ETF
JUSA,JPMorgan ActiveBuilders U.S. Large Cap Equity ETF
JUST,Goldman Sachs JUST U.S. Large Cap Equity ETF
JVAL,JPMorgan U.S. Value Factor ETF
KAPR,Innovator U.S. Small Cap Power Buffer ETF - April
KBE,SPDR S&P Bank ETF
KBWB,Invesco KBW Bank ETF
KBWD,Invesco KBW High Dividend Yield Financial ETF
KBWR,Invesco KBW Regional Banking ETF
KBWY,Invesco KBW Premium Yield Equity REIT ETF
KCCA,KraneShares California Carbon Allowance Strategy ETF
KCE,SPDR S&P Capital Markets ETF
KIE,SPDR S&P Insurance ETF
KJAN,Innovator U.S. Small Cap Power Buffer ETF - January
KJUL,Innovator U.S. Small Cap Power Buffer ETF - July
KLCD,KFA Large Cap Quality Dividend Index ETF
KNG,FT Cboe Vest S&P 500 Dividend Aristocrats Target Income ETF
KOCT,Innovator U.S. Small Cap Power Buffer ETF - October
KOLD,ProShares UltraShort Bloomberg Natural Gas
KONG,ETF Opportunities Trust Formidable Fortress ETF
KRE,SPDR S&P Regional Banking ETF
KRMA,Global X Conscious Companies ETF
KSCD,KFA Small Cap Quality Dividend Index ETF
KVLE,KraneShares Trust KFA Value Line Dynamic Core Equity Index ETF
LBAY,Leatherback Long/Short Alternative Yield ETF
LCG,Sterling Capital Focus Equity ETF
LCR,Leuthold Core ETF
LCTU,BlackRock U.S. Carbon Transition Readiness ETF
LD,Barclays PLC
LEAD,Siren DIVCON Leaders Dividend ETF
LEXI,Alexis Practical Tactical ETF
LFEQ,VanEck Long/Flat Trend ETF
LGH,HCM Defender 500 Index ETF
LGLV,SPDR SSGA US Large Cap Low Volatility Index ETF
LGOV,First Trust Long Duration Opportunities ETF
LKOR,FlexShares Trust FlexShares Credit-Scored US Long Corporate Bo
LMBS,First Trust Low Duration Opportunities ETF
LOPP,Gabelli Love Our Planet & People ETF Gabelli Love Our Planet &
LQDB,iShares Trust iShares BBB Rated Corporate Bond ETF
LQDI,iShares Inflation Hedged Corporate Bond ETF
LRGE,ClearBridge Large Cap Growth ESG ETF
LRGF,iShares U.S. Equity Factor ETF
LRNZ,TrueShares Technology AI & Deep Learning ETF
LSAF,LeaderShares AlphaFactor US Core Equity ETF
LSST,Natixis ETF Trust Natixis Loomis Sayles Short Duration Income 
LTL,ProShares Ultra Telecommunications ProShares
LTPZ,Pimco 15  Year U.S. TIPS Index Exchange-Traded Fund
LVHD,Franklin U.S. Low Volatility High Dividend Index ETF
LVOL,American Century Low Volatility ETF
LYFE,2ndVote Life Neutral Plus ETF
MAAX,VanEck ETF Trust VanEck Muni Allocation ETF
MAGA,Point Bridge America First ETF
MAMB,Monarch Ambassador Income ETF
MARB,First Trust Merger Arbitrage ETF
MARZ,TrueShares Structured Outcome (March) ETF
MBB,iShares MBS ETF
MBBB,VanEck Moody's Analytics BBB Corporate Bond ETF
MBCC,Monarch Blue Chips Core ETF
MBND,SPDR Nuveen Municipal Bond ETF
MBOX,Freedom Day Dividend ETF
MBSD,FlexShares Trust FlexShares Disciplined Duration MBS Index Fun
MCRO,IQ Hedge Macro Tracker ETF
MDCP,VictoryShares THB Mid Cap ESG ETF
MDIV,Multi-Asset Diversified Income Index Fund
MDY,SPDR MidCap Trust Series I
MDYG,SPDR S&P 400 Mid Cap Growth ETF (based on S&P MidCap 400 Growt
MDYV,SPDR S&P 400 Mid Cap Value ETF (based on S&P MidCap 400 Value 
MEAR,BlackRock Short Maturity Municipal Bond ETF
MEXX,Direxion Daily MSCI Mexico Bull 3X Shares
MFLX,First Trust Flexible Municipal High Income ETF
MFUS,PIMCO Equitiy Series PIMCO RAFI Dynamic Multi-Factor U.S. Equi
MGC,Vanguard Mega Cap ETF
MGK,Vanguard Mega Cap Growth ETF
MGMT,Ballast Small/Mid Cap ETF
MGV,Vanguard Mega Cap Value ETF
MID,American Century Mid Cap Growth Impact ETF
MIDE,Xtrackers S&P MidCap 400 ESG ETF
MIDU,Direxion Mid Cap Bull 3X Shares
MIG,VanEck Moody's Analytics IG Corporate Bond ETF
MILN,Global X Millennial Consumer ETF
MINO,PIMCO Municipal Income Opportunities Active Exchange-Traded Fu
MJIN,ETFMG 2x Daily Inverse Alternative Harvest ETF
MLN,VanEck ETF Trust VanEck Long Muni ETF
MLPA,Global X MLP ETF
MLPB,UBS AG
MLPO,Credit Suisse AG
MLPR,ETRACS Quarterly Pay 1.5X Leveraged Alerian MLP Index ETN
MLPX,Global X MLP & Energy Infrastructure ETF
MMIN,IQ MacKay Municipal Insured ETF 
MMIT,IQ MacKay Municipal Intermediate ETF
MMLG,First Trust Multi-Manager Large Growth ETF
MMTM,SPDR S&P 1500 Momentum Tilt ETF
MOAT,VanEck Morningstar Wide Moat ETF
MOON,Direxion Moonshot Innovators ETF
MORT,VanEck Mortgage REIT Income ETF
MOTE,VanEck Morningstar ESG Moat ETF
MRSK,Toews Agility Shares Managed Risk ETF
MSOS,AdvisorShares Trust AdvisorShares Pure US Cannabis ETF
MSTB,Lha Market State Tactical Beta ETF
MSVX,LHA Market State Alpha Seeker ETF
MTGP,WisdomTree Mortgage Plus Bond Fund
MTUL,ETRACS 2x Leveraged MSCI US Momentum Factor TR ETN
MTUM,iShares MSCI USA Momentum Factor ETF
MUB,iShares National Muni Bond ETF
MUNI,PIMCO Intermediate Municipal Bond Active Exchange-Traded Fund
MUST,Columbia Multi-Sector Municipal Income ETF
MVRL,ETRACS Monthly Pay 1.5X Leveraged Mortgage REIT ETN
MVV,ProShares Ultra MidCap400
MYY,ProShares Short MidCap400
MZZ,ProShares UltraShort MidCap400
NACP,Impact Shares Trust I Impact Shares NAACP Minority Empowerment
NAIL,Direxion Daily Homebuilders & Supplies Bull 3X Shares
NANR,SPDR S&P North American Natural Resources ETF
NAPR,Innovator Growth-100 Power Buffer ETF - April
NDVG,Nuveen Dividend Growth ETF
NETL,NETLease Corporate Real Estate ETF
NIB,Barclays PLC
NJAN,Innovator Growth-100 Power Buffer ETF - January
NJUL,Innovator Growth-100 Power Buffer ETF - July
NOBL,ProShares S&P 500 Dividend Aristocrats ETF
NOCT,Innovator Growth-100 Power Buffer ETF- October
NOVZ,TrueShares Structured Outcome (November) ETF
NRGD,Bank Of Montreal
NRGU,Bank Of Montreal
NSCS,Nuveen Small Cap Select ETF
NTSX,WisdomTree U.S. Efficient Core Fund
NUAG,Nuveen Enhanced Yield U.S. Aggregate Bond ETF
NUBD,Nuveen ESG U.S. Aggregate Bond ETF
NUDV,Nuveen ESG Dividend ETF
NUGO,Nuveen Growth Opportunities ETF
NUHY,Nuveen ESG High Yield Corporate Bond ETF
NULC,Nuveen ESG Large-Cap ETF
NULG,Nuveen ESG Large-Cap Growth ETF
NULV,Nuveen ESG Large-Cap Value ETF
NUMG,Nuveen ESG Mid-Cap Growth ETF
NUMV,Nuveen ESG Mid-Cap Value ETF
NURE,Nuveen Short-Term REIT ETF
NUSA,Nuveen Enhanced Yield 1-5 Year U.S. Aggregate Bond ETF
CALF,Pacer US Small Cap Cash Cows 100 ETF
CANE,Teucrium Sugar Fund ETV
CAPE,DoubleLine ETF Trust DoubleLine Shiller CAPE U.S. Equities ETF
CARZ,First Trust S-Network Future Vehicles & Technology ETF
CATH,Global X S&P 500 Catholic Values ETF
CBLS,Changebridge Capital Long/Short Equity ETF
CBSE,Changebridge Capital Sustainable Equity ETF
CCOR,Core Alternative ETF
CCRV,iShares U.S. ETF Trust iShares Commodity Curve Carry Strategy 
CDC,VictoryShares US EQ Income Enhanced Volatility Wtd ETF
CDL,VictoryShares US Large Cap High Div Volatility Wtd ETF
CEFD,ETRACS Monthly Pay 1.5X Leveraged Closed-End Fund Index ETN
CEFS,Exchange Listed Funds Trust ETF
